{
  "summary": "Label regex 15_exclamation: expected False",
  "description": "Expected Jira acceptance: False.",
  "labels": [
    "test!"
  ],
  "steps": [
    {
      "system": "Jira labels",
      "action": "Create a test issue with the candidate label.",
      "expected_result": "Jira lehnt das Label ab."
    }
  ]
}
